no,shop,name,rating,date,review_text
73,Kao Beauty & Personal Care,ลักษณา ญ.,5,2024-09-25,ควบคุมน้ำมันและความเงางาม เหมาะสำหรับการใช้งานทุกวัน เหมาะสำหรับใช้ใต้เครื่องสำอาง รู้สึกสบายบนผิว
74,Kao Beauty & Personal Care,ก***.,5,2023-11-12,สินค้าคุณภาพดีมากค่ะ ราคาไม่แพงค่ะ แพ็คสินค้าดีมากค่ะ ส่งสินค้าไวมากค่ะ การให้บริการจากผู้ขายดีมากค่ะ การให้บริการจากขนส่งดีมากค่ะ
75,Kao Beauty & Personal Care,ก***.,5,2023-11-12,สินค้าคุณภาพดีมากค่ะ ราคาไม่แพงค่ะ แพ็คสินค้าดีมากค่ะ ส่งสินค้าไวมากค่ะ การให้บริการจากผู้ขายดีมากค่ะ การให้บริการจากขนส่งดีมากค่ะ
76,Kao Beauty & Personal Care,N***.,5,2023-08-12,คุณภาพดีเบาและหอมกลิ่นน้ำนม เนื้อสัมผัสละมุนน่าใช้ทาง่ายมากสบายผิวไม่หนักหน้า ประสิทธิภาพกันแดดได้ดีหน้าไม่มันเยิ้มหลังทาแล้ว
77,Kao Beauty & Personal Care,L***.,5,2021-03-28,ได้รับสินค้าแล้วค่ะ จัดส่งส่งรวดเร็วมากกกทันใจ ทันใช้งาน แพ็คสินค้าอย่างดี ไม่เสียหาย ราคาถูกคุ้มค่า กว่าไปซื้อในห้าง
78,Kao Beauty & Personal Care,I***m,5,2023-09-17,ได้รับสินค้าถูกต้องครบถ้วนตามที่สั่ง ร้านค้าจัดส่งสินค้ารวดเร็ว สินค้าไม่เสียหายคุณภาพดีตรงตามประกาศ ราคาไม่แพง
79,Kao Beauty & Personal Care,ทศพล จ.,5,2024-03-14,เนียนและใช้ง่าย รู้สึกสบายบนผิว ไม่เหลือเชื้อขาวบนผิว ทิ้งผลลัพธ์เป็นเนื้อเรียบ
80,Kao Beauty & Personal Care,N***s,5,2023-09-11,คุณภาพ ดีงามมากค่ะ ใช้แล้วติดใจ เนื้อสัมผัส เนื้อสัมผัสบางเบา ไม่เหนียวเหนอะหนะ ประสิทธิภาพ สามารถป้องกันแดดได้ดีมากค่ะ
81,Kao Beauty & Personal Care,B***.,5,2023-10-16,ประสิทธิภาพใช้ครีมกันแดดของบิโอเรมานานแล้ว ครีมซึมซับเร็วไม่เหนอะหนะ แห้งง่าย เบาสบายสุด ไปเลย
82,Kao Beauty & Personal Care,Rinlaphat M.,5,2023-10-30,เหมาะสำหรับผิวผสม เนียนและใช้ง่าย เนียนและใช้ง่าย ไม่เหลือเชื้อขาวบนผิว เบาสบายผิว
83,Kao Beauty & Personal Care,ว***.,5,2024-03-06,จัดส่งรวดเร็วมาก ได้รับสินค้าครบถ้วน ของแถมอลังการ จัดส่งรวดเร็วมาก ได้รับสินค้าครบถ้วน ของแถมอลังการ
84,Kao Beauty & Personal Care,0***5,5,2024-03-06,ดีสำหรับใช้ใต้เมคอัพ เบาสบายและไม่มีความมัน ช่วยปกป้องจากแสงแดดสูง รู้สึกสบายบนผิว
85,Kao Beauty & Personal Care,พัชรินทร์ ห.,5,2023-10-10,ส่งสินค้าเร็วมากค่ะ ราคาถูก ใช้ส่วนลดได้เยอะ คุ้มมาก เดี๋ยวรอให้มีคูปองมาอีกจะซื้อตุนใหม่
86,Kao Beauty & Personal Care,****0,5,2024-02-28,ได้รับพัสดุแล้วค่ะ ชอบใช้กันแดดตัวนี้เพราะมันกันน้ำกันเหงื่อดีมาก เนื้อสัมผัสทาลื่น เกลี่ยง่าย ประสิทธิภาพกันแดดดีเยี่ยม
87,Kao Beauty & Personal Care,อภิชา อ.,5,2023-06-18,สินค้าคุณภาพดีมากสั่งครั้งก่อนยังไม่หมดแต่เมื่อมีโปรดี ต้องรีบสั่งมาเก็บ ใช้นานๆ
88,Kao Beauty & Personal Care,w***.,5,2024-02-28,เหมาะสำหรับใช้ทุกวันได้รับสินค้าเรียบร้อย จัดส่งได้รวดเร็วทันใจมาก บรรจุภัณฑ์มาดีไม่เสียหาย
89,Kao Beauty & Personal Care,กวิตา พ.,5,2022-01-05,คุ้มมาก ถูกที่สุดตอนโปรและแท้จากข้อป
90,Kao Beauty & Personal Care,ภ***.,5,2024-08-06,คุณภาพอ่อนโยนและไม่ทำให้ผิวระคายเคือง ช่วยให้เมคอัพเกิดฐานเนียน เบาสบายและไม่มีความมัน
91,Kao Beauty & Personal Care,ช***.,5,2024-02-10,เหมาะสำหรับผิวผสม อ่อนโยนและไม่ทำให้ผิวระคายเคือง ไม่เหลือเชื้อขาวบนผิว เนียนและใช้ง่าย
92,Kao Beauty & Personal Care,Nusara,5,2024-02-10,ใช้แล้วคุมมันดีมากจริงๆ ค่ะ อยู่กรุงเทพฯ จัดส่งเร็วมากจนตกใจ วันเดียวถึงเลย ใช้คูปองซื้อช่วงลดราคา ได้ราคาดีมากค่ะ
93,Kao Beauty & Personal Care,ณ***า,5,2023-05-11,ครั้งนี้ซื้อ 9 ชิ้น จะซื้อเยอะแค่ไหน ก็ไม่เคยมีของแถมสักชิ้น อ่านรีวิวลูกค้าท่านอื่นที่ได้ของแถม ก็ต้องมาคิดว่าทำไมทางร้านต้องเลือกปฏิบัติกับเราขนาดนี้ เหมือนเราไม่ใช่ลูกค้า การกดดาวให้คะแนน คือ ต้องให้คะแนนทางร้าน 5 ดาว ถ้าไม่ใช่ 5 ดาว ก็กดส่งรีวิวนี้ไม่ได้
94,Kao Beauty & Personal Care,Aaleeb,1,2023-01-28,ขนส่งน่าเกลียดมากปรับปรุงด้วย ก่อนส่งไม่โทร วางของไว้นอกบ้าน หายรับผิดชอบไหม
95,Kao Beauty & Personal Care,Aaleeb,1,2022-12-20,แพคของไม่ดีเลยจ้า ขวดเปื้อนด้วยต้องเอามาล้างน้ำอีกหลายครั้งเลย เหมือนฝุ่นเยอะมาก
96,Kao Beauty & Personal Care,มยุลี ภ.,1,2021-09-21,การจัดส่งสุดแสนจะช้า ห่วยแตกที่สุดใน 3 โลก รอของนาน 10 วันเต็มหลังกดสั่ง คือโปร 9 เดือน 9 บริษัทมีแต่ความสามารถในการจัดโปร คือ เก่งมากจ้ะ แต่ ห่วยสุดจะบรรยาย แบบนี้อย่าขายเองเลย จงให้ อื่นที่เป็นมืออาชีพช่วยขายให้แบบเดิมอะดีแล้วเนาะ เข่น ไปอะไรไปเนาะ นี่ถ้าไม่ตามจิกตามจี้ก็คงไม่ได้ของนะ ถามไป วันที่ 17 กย ก็เลยได้ของ 19 กย สุด ไปเลยจ้า เอาไป 10 กะโหลก หาเปลี่ยน มั้ยย
97,Kao Beauty & Personal Care,Ratkamol T.,1,2022-11-16,เพิ่งเคยซื้อ ผ่านร้านออนไลน์ครั้งแรกบอกเลยว่าไม่ประทับใจ งงกับตรรกะการให้ของแถมมาก คือเราสั่งไปทั้งหมด 3 แต่ ที่มูลค่าน้อยที่สุดกลับได้ของแถมเยอะสุด คือ อื่นๆได้แค่แผ่นอนามัย 1 ซอง แต่ออเดอร์ที่มูลค่าน้อยที่สุดกลับได้แผ่นอนามัยบวกกับเอนชัวร์อีก 1 ซอง อีกทั้งร้านค้าโปรโมชั่นไม่ชัดเจนไม่สามารถอ่านได้ว่าต้องซื้อถึงมูลค่าเท่าไหร่ถึงจะได้ของแถมพนักงานก็ตอบคำถามค่อนข้างช้ามาก ก็เข้าใจอ่ะนะว่าออเดอร์เยอะมีลูกค้าสอบถามเข้ามาเยอะก็ไปคิดวิธีแก้ปัญหากันเอาเองแล้วกันนะสำหรับเราคง บาย
98,Kao Beauty & Personal Care,Arsarn K.,1,2023-03-06,ใส่กันกระแทกมา แต่กล่องก็ยังบุบ
99,Kao Beauty & Personal Care,นัชชา ก.,1,2021-11-29,ส่งสินค้าให้ผิดเสียเวลาแทนที่จะได้ใช้สินค้าตามที่สั่งซื้อแล้วต้องรอต่อไปในการเปลี่ยนสินค้ากลับไปกลับมาและโทรนัดจะมารับของก็ไม่ได้รักษาคำพูดตามกำหนด สรุปจนถึงตอนนี้ยังไม่ได้ใช้สินค้าเลย ซื้อครั้งแรกและครั้งเดียวพอแล้วค่ะ
100,Kao Beauty & Personal Care,a***.,3,2021-10-21,สินค้าคุณภาพดี ราคา ร้านจัดส่งเร็ว
101,Kao Beauty & Personal Care,ส***.,3,2024-01-12,ส่งไม่ช้าไม่เร็ว ได้ราคาตอนโปรถูกดี แต่ใช้เวลาทำ นาน บอก 1 เดือนให้รอตามนั้นนะ
102,Kao Beauty & Personal Care,M***.,4,2021-06-12,สินค้าโอเค แพ็คของมาดี แต่รอส่งนานมาก สั่ง7ได้ของ11 ส่งเร็วกว่านี้จะดีมาก เลย บางอันผลิตปี20เดือน10 ยังพอโอเคอยู่ บางอันผลิตปี21
103,Kao Beauty & Personal Care,ว***.,4,2024-06-12,ช่วยปกป้องจากแสงแดด ช่วยปกป้องจากแสงแดด ช่วยปกป้องจากแสงแดด ช่วยปกป้องจากแสงแดดดดดดดดด
104,Kao Beauty & Personal Care,N***.,4,2022-02-18,ได้รับสินค้าแล้วรวดเร็วดี ลองใช้แล้วเนื้อเป็นน้ำนม ควบคุมมันได้ดี สามารถเป็นเบสลงก่อนแต่งหน้าได้
105,Kao Beauty & Personal Care,อ***.,4,2024-07-05,มาดี ราคาไม่แพงแต่ผลิตตั้งแต่เดือน 1123 มิน่าทำไมราคาถูก ก็ต้องยอมรับนะชอบของลดราคา
106,Kao Beauty & Personal Care,แก้วตา บ.,4,2020-05-26,จัดส่งไว สินค้าไม่มีปัญหา แต่ช่วงที่ซื้อโลตัสลดราคาถูกกว่าเยอะค่ะ เสียดายที่ไม่ได้เช็คราคาที่อื่นก่อนซื้อ
107,Kao Beauty & Personal Care,หิรัญ,5,2021-04-20,ส่งเร็วมาก
